{
  "items": [
    {
      "action": "fellBackToComposite",
      "bounds": {
        "h": 5,
        "w": 6,
        "x": 0,
        "y": 0
      },
      "feature": "adjustment",
      "layerPath": "Curves 1",
      "matrixRow": "AD-17",
      "note": "adjustment `curv` not mapped at import v1; appearance preserved from the composite",
      "severity": "warning"
    }
  ],
  "outcome": "imported",
  "producer": {
    "app": "Appname",
    "version": "0.1.0"
  },
  "schema": "appname.compatReport.v1",
  "skippedResources": [],
  "source": {
    "channels": 3,
    "colorMode": "rgb",
    "depth": 8,
    "format": "psd",
    "path": "",
    "size": [
      6,
      5
    ]
  },
  "summary": {
    "approximated": 0,
    "dropped": 0,
    "fellBackToComposite": 1,
    "imported": 0,
    "rasterized": 0,
    "warnings": 1
  }
}
